{
  "sourceFile": "사내보고서_양식.hwpx",
  "extraction": { "method": "xml", "openedHeaderXml": true },
  "page": {
    "paper": "A4",
    "orientation": "portrait",
    "marginMm": { "top": 20, "bottom": 15, "left": 30, "right": 30, "header": 15, "footer": 15 },
    "columns": 1
  },
  "roles": {
    "documentTitle": {
      "present": true,
      "source": "xml",
      "ids": { "charPrIDRef": "12", "paraPrIDRef": "4", "styleIDRef": "1", "borderFillIDRef": null },
      "fontHangul": "함초롬돋움",
      "fontLatin": "함초롬돋움",
      "sizePt": 18,
      "color": "#000000",
      "bold": true,
      "italic": false,
      "underline": false,
      "align": "center",
      "lineSpacing": { "type": "PERCENT", "display": "160%" },
      "spaceBeforePt": 0,
      "spaceAfterPt": 8,
      "indentMm": 0,
      "unknownReason": null
    },
    "heading1": {
      "present": true,
      "source": "xml",
      "ids": { "charPrIDRef": "8", "paraPrIDRef": "6", "styleIDRef": "2", "borderFillIDRef": null },
      "fontHangul": "함초롬돋움",
      "fontLatin": "함초롬돋움",
      "sizePt": 16,
      "color": "#000000",
      "bold": true,
      "italic": false,
      "underline": false,
      "align": "left",
      "lineSpacing": { "type": "PERCENT", "display": "160%" },
      "spaceBeforePt": 10,
      "spaceAfterPt": 6,
      "indentMm": 0,
      "unknownReason": null
    },
    "heading2": {
      "present": true,
      "source": "xml",
      "ids": { "charPrIDRef": "9", "paraPrIDRef": "7", "styleIDRef": "3", "borderFillIDRef": null },
      "fontHangul": "함초롬돋움",
      "fontLatin": "함초롬돋움",
      "sizePt": 13,
      "color": "#000000",
      "bold": true,
      "italic": false,
      "underline": false,
      "align": "left",
      "lineSpacing": { "type": "PERCENT", "display": "160%" },
      "spaceBeforePt": 8,
      "spaceAfterPt": 4,
      "indentMm": 0,
      "unknownReason": null
    },
    "heading3": { "present": false, "unknownReason": "A에 제목3 스타일 없음" },
    "body": {
      "present": true,
      "source": "frequency",
      "ids": { "charPrIDRef": "1", "paraPrIDRef": "3", "styleIDRef": "0", "borderFillIDRef": null },
      "fontHangul": "함초롬바탕",
      "fontLatin": "Times New Roman",
      "sizePt": 13,
      "color": "#000000",
      "bold": false,
      "italic": false,
      "underline": false,
      "align": "justify",
      "lineSpacing": { "type": "PERCENT", "display": "160%" },
      "spaceBeforePt": 0,
      "spaceAfterPt": 0,
      "indentMm": 0,
      "unknownReason": null
    },
    "caption": { "present": false, "unknownReason": "A에서 캡션 문단을 찾지 못함" },
    "list": {
      "present": true,
      "source": "xml",
      "ids": { "charPrIDRef": "1", "paraPrIDRef": "10", "styleIDRef": "0", "borderFillIDRef": null },
      "fontHangul": "함초롬바탕",
      "fontLatin": "Times New Roman",
      "sizePt": 13,
      "color": "#000000",
      "bold": false,
      "italic": false,
      "underline": false,
      "align": "justify",
      "lineSpacing": { "type": "PERCENT", "display": "160%" },
      "spaceBeforePt": 0,
      "spaceAfterPt": 0,
      "indentMm": -5,
      "unknownReason": null
    },
    "tableHeader": {
      "present": true,
      "source": "xml",
      "ids": { "charPrIDRef": "11", "paraPrIDRef": "3", "styleIDRef": "0", "borderFillIDRef": "5" },
      "fontHangul": "함초롬돋움",
      "fontLatin": "함초롬돋움",
      "sizePt": 12,
      "color": "#000000",
      "bold": true,
      "italic": false,
      "underline": false,
      "align": "center",
      "lineSpacing": { "type": "PERCENT", "display": "130%" },
      "unknownReason": null
    },
    "tableBody": {
      "present": true,
      "source": "xml",
      "ids": { "charPrIDRef": "1", "paraPrIDRef": "3", "styleIDRef": "0", "borderFillIDRef": "5" },
      "fontHangul": "함초롬바탕",
      "fontLatin": "Times New Roman",
      "sizePt": 12,
      "color": "#000000",
      "bold": false,
      "italic": false,
      "underline": false,
      "align": "center",
      "lineSpacing": { "type": "PERCENT", "display": "130%" },
      "unknownReason": null
    },
    "quote": { "present": false },
    "emphasis": {
      "present": true,
      "source": "xml",
      "ids": { "charPrIDRef": "3", "paraPrIDRef": null, "styleIDRef": null, "borderFillIDRef": null },
      "fontHangul": "함초롬바탕",
      "fontLatin": "Times New Roman",
      "sizePt": 13,
      "color": "#000000",
      "bold": true,
      "italic": false,
      "underline": false,
      "align": null,
      "unknownReason": null
    },
    "headerChrome": { "present": false },
    "footerChrome": { "present": false }
  },
  "tableChrome": {
    "present": true,
    "outerWidthMm": 0.12,
    "innerWidthMm": 0.12,
    "lineStyle": "SOLID",
    "lineColor": "#000000",
    "headerFill": "#D9E1F2",
    "bodyFill": null,
    "usedEngineDefaultBorder": false
  },
  "notes": ["표 안 문단은 body 빈도 집계에서 제외함"]
}
